{
  "$schema": "https://json-schema.org/draft/2020-12/schema",
  "$id": "https://github.com/li-neo/one-skills/schemas/pack.schema.json",
  "title": "One Skills Pack",
  "type": "object",
  "required": [
    "schema_version",
    "id",
    "name",
    "slug",
    "profile",
    "mode",
    "sources",
    "access_level",
    "consent",
    "recipe",
    "created_at"
  ],
  "properties": {
    "schema_version": {"enum": ["0.2", "0.3", "0.4"]},
    "id": {"type": "string", "minLength": 1},
    "name": {"type": "string", "minLength": 1},
    "slug": {"type": "string", "pattern": "^[a-z0-9\\u4e00-\\u9fff]+(?:-[a-z0-9\\u4e00-\\u9fff]+)*$"},
    "profile": {"type": "string", "pattern": "^[a-z][a-z0-9-]{1,63}$"},
    "mode": {"enum": ["quick", "standard", "deep", "continuous"]},
    "sources": {"type": "array", "items": {"type": "string"}, "minItems": 1},
    "source_catalog": {"type": ["string", "null"]},
    "object_overview_hash": {"type": ["string", "null"]},
    "capability_portfolio_hash": {"type": ["string", "null"]},
    "capability_graph_hash": {"type": ["string", "null"]},
    "activation_aliases": {
      "type": "array",
      "items": {"type": "string", "minLength": 1},
      "uniqueItems": true
    },
    "semantic_contract": {
      "type": "object",
      "properties": {
        "overview_confirmation": {"enum": ["pending", "confirmed", "stale"]},
        "capability_confirmation": {"enum": ["pending", "confirmed", "stale"]}
      },
      "additionalProperties": false
    },
    "access_level": {"enum": ["public", "authorized", "private-local"]},
    "consent": {
      "enum": ["self", "consented", "work-authorized", "public-only", "not-applicable"]
    },
    "recipe": {
      "type": "object",
      "required": ["id", "version"],
      "properties": {
        "id": {"type": "string", "minLength": 1},
        "version": {"type": "string", "minLength": 1}
      },
      "additionalProperties": false
    },
    "recipe_lock": {
      "type": "object",
      "required": ["schema_version", "locked_at", "recipe"]
    },
    "reproducibility": {
      "type": "object",
      "required": [
        "schema_version",
        "source_hashes",
        "protected",
        "canonical_eval_hashes",
        "runtime_eval_hashes"
      ]
    },
    "lifecycle": {
      "type": "object",
      "required": ["schema_version", "pack_id", "current_phase", "phases"]
    },
    "created_at": {"type": "string"},
    "updated_at": {"type": "string"},
    "migrated_at": {"type": "string"}
  },
  "allOf": [
    {
      "if": {
        "properties": {"schema_version": {"const": "0.4"}}
      },
      "then": {
        "required": ["recipe_lock", "reproducibility", "lifecycle"]
      }
    }
  ],
  "additionalProperties": false
}
