{
  "schema_version": "0.2",
  "id": "pack-20260806041631466236-ac040845",
  "name": "ai-neural-networks-90min",
  "slug": "ai-neural-networks-90min",
  "profile": "content",
  "mode": "deep",
  "sources": [
    "courses/ai-neural-networks-90min/FEISHU_COURSE.md",
    "courses/ai-neural-networks-90min/TIMELINE.md",
    "courses/ai-neural-networks-90min/SOURCE_NOTES.md",
    "courses/ai-neural-networks-90min/sources/metadata.json"
  ],
  "source_catalog": null,
  "access_level": "public",
  "consent": "not-applicable",
  "recipe": {
    "id": "content-standard",
    "version": "1.0.0"
  },
  "created_at": "2026-08-06T04:16:31+00:00"
}
