{
  "schema_version": "0.4",
  "id": "pack-20260807074344701780-f226577d",
  "name": "mao-methods",
  "slug": "mao-methods",
  "profile": "methodology",
  "mode": "deep",
  "sources": [
    "https://www.12371.cn/special/mzdxj/dyj/#investigation-practice",
    "https://www.12371.cn/special/mzdxj/dyj/#on-contradiction",
    "https://www.12371.cn/special/mzdxj/d3j/#leadership-methods",
    "https://www.12371.cn/special/mzdxj/d4j/#committee-methods",
    "https://www.gov.cn/test/2008-06/23/content_1024934_3.htm",
    "https://www.nber.org/papers/w16361",
    "https://www.dswxyjy.org.cn/n1/2021/0118/c219000-32003108.html"
  ],
  "source_catalog": "examples/mao-methods/SOURCE_CATALOG.json",
  "access_level": "public",
  "consent": "not-applicable",
  "recipe": {
    "id": "methodology-standard",
    "version": "2.0.0"
  },
  "object_overview_hash": "c24e33c2d123109584c8b1890f73f86355bedd13246302f3d7d1dec1988531cb",
  "capability_portfolio_hash": "43e56d8a1eadb34a18627a742948d0f4d329bee09b13adcb76bf7904d97d41ff",
  "capability_graph_hash": "361873953f5f38123746df8afcd1aa51867844d1eaee8bb7816fee7096f7f4f4",
  "semantic_contract": {
    "overview_confirmation": "confirmed",
    "capability_confirmation": "confirmed"
  },
  "activation_aliases": [
    "mao-methods",
    "毛泽东方法",
    "毛选方法",
    "用毛选",
    "毛泽东著作方法"
  ],
  "created_at": "2026-08-07T07:43:44+00:00",
  "recipe_lock": {
    "schema_version": "1.0",
    "locked_at": "2026-08-07T07:43:44+00:00",
    "recipe": {
      "id": "methodology-standard",
      "version": "2.0.0",
      "profile": "methodology",
      "parser": "structural-text@2.0.0",
      "chunker": "semantic-section@2.0.0",
      "extractors": [
        "assumptions",
        "mechanism",
        "branches",
        "applications",
        "failures"
      ],
      "verifier": "portfolio-v1-v2-v3@2.0.0",
      "builder": "methodology-atomic-network@2.0.0"
    }
  },
  "reproducibility": {
    "schema_version": "1.0",
    "created_at": "2026-08-07T07:43:44+00:00",
    "source_hashes": {
      "source-20260807065604315262-316856da@3": "d28b7cddd3a36bae9f99bd63f3b69bc771bf44383319181c46568c9821269d2d",
      "source-20260807065604326533-44d161a3@3": "67d1c30d5e939681a03d741ff0e6ef0df788091982a48324efc3155b95dd6ec6",
      "source-20260807065604330869-0a1cb30c@3": "8e713c363df17920a79e6059fd32c849116eda41792e50e48b19b525613d0920",
      "source-20260807065604336336-39f8add9@2": "91262b41dce9ac397b70320834df854f8bdb0295c90ebcc2cc7af2b08de35ebd",
      "source-20260807065604341116-4366a3ab@3": "4115e4b0ebd3256be58dc6e54f5b4122fa38744af325d9060867ae83f2955cd7",
      "source-20260807065604346878-72aaabe8@3": "06799c75821781bc8a4143e8f3fccfe26da34a732e72314350355b19fd7bf750",
      "source-20260806164901573671-84f52e1f@2": "6dba651e8aa6229b9e18f8c1dcbeac07e33364408a13eec4876b4825b6144b48"
    },
    "protected": [
      "source_facts",
      "authorization",
      "safety_boundaries",
      "negative_tests",
      "canonical_evals"
    ],
    "canonical_eval_hashes": {
      "mao-methods": "d6f1031602c0da67e5d70e0828d0f99a8b5c51b1cacac39d0b8655f0e46d6662"
    },
    "runtime_eval_hashes": {
      "mao-methods": "7ae40971789bff30e1f86884160332352fd5ca73f7411f6e1ec12c155990d08c"
    },
    "evaluation_suite_hashes": {
      "mao-methods-blind-comparison-v1": "17a919542daaf6686d504ab0eb1f1a6739a9670bb5fdb8b6595e451d2b31dfc6"
    },
    "skill_hashes": {
      "mao-methods": "78ba4e592a1a971f1d54cf713cad2d4c0020dd3f326bf5f6ad27ca9a8108fe09"
    },
    "source_quality_hash": "a04d9dc36a6e735f3e38dca3e147778ee2a4ab61fae50a46be6efca066baa645",
    "object_overview_hash": "c24e33c2d123109584c8b1890f73f86355bedd13246302f3d7d1dec1988531cb",
    "capability_portfolio_hash": "43e56d8a1eadb34a18627a742948d0f4d329bee09b13adcb76bf7904d97d41ff",
    "capability_graph_hash": "361873953f5f38123746df8afcd1aa51867844d1eaee8bb7816fee7096f7f4f4"
  },
  "lifecycle": {
    "schema_version": "1.0",
    "pack_id": "pack-20260807074344701780-f226577d",
    "current_phase": "evolve",
    "created_at": "2026-08-07T07:43:44+00:00",
    "updated_at": "2026-08-07T09:20:50+00:00",
    "phases": {
      "contract": {
        "status": "completed",
        "updated_at": "2026-08-07T07:43:44+00:00",
        "notes": "contract generated from explicit CLI inputs"
      },
      "ingest": {
        "status": "completed",
        "updated_at": "2026-08-07T07:43:44+00:00",
        "notes": "indexed 7 sources"
      },
      "map": {
        "status": "completed",
        "updated_at": "2026-08-07T07:43:44+00:00",
        "notes": "profile map initialized"
      },
      "extract": {
        "status": "completed",
        "updated_at": "2026-08-07T07:43:45+00:00",
        "notes": "extracted 78 candidates"
      },
      "verify": {
        "status": "completed",
        "updated_at": "2026-08-07T09:09:49+00:00",
        "notes": "role-separated V1/V2/V3 and human portfolio confirmation passed"
      },
      "compile": {
        "status": "completed",
        "updated_at": "2026-08-07T09:09:49+00:00",
        "notes": "compiled 12 internal modules behind mao-methods"
      },
      "link": {
        "status": "completed",
        "updated_at": "2026-08-07T09:09:49+00:00",
        "notes": "capability graph, index, glossary, digest, and learning path projected"
      },
      "test": {
        "status": "completed",
        "updated_at": "2026-08-07T09:20:50+00:00",
        "notes": "independent tests and hard gates passed"
      },
      "ship": {
        "status": "completed",
        "updated_at": "2026-08-07T09:20:50+00:00",
        "notes": "reports generated and release gate passed"
      },
      "evolve": {
        "status": "in_progress",
        "updated_at": "2026-08-07T09:20:50+00:00",
        "notes": ""
      }
    }
  },
  "migrated_at": "2026-08-10T07:28:11+00:00"
}
